ID,Severity,Status,Area,File,Lines,Finding,Impact,Fix direction,Verification,Architecture relation,Permalink,Latest review status,Latest review note,Reviewed head
FS-064,High,Confirmed-static,Collaboration / buffering,crates/flowstate/src/collab/session_io.rs,20-45,Remote updates received before runtime attachment are stored in an unbounded VecDeque.,A peer can exhaust memory before document attachment completes.,Bound by message count and total bytes; spill/reject and trigger one version-vector pull after attach.,Delay attach and flood unique updates.,P2P input queues must be bounded.,https://github.com/realartists-gitmo/flowstate/blob/0d0ecea88c71f90ddf6cc266da028242c8366646/crates/flowstate/src/collab/session_io.rs#L20-L45,Unchanged,The latest two commits do not modify the code establishing this finding.,9cb8ad8add47db2e3cefd611053a8d99e4ce4048
FS-065,High,Confirmed-static,Anti-entropy / robustness,crates/flowstate/src/collab/session.rs,380-450,Malformed digest/version-vector data propagates as a session-fatal error.,One bad peer packet can detach a healthy collaborative session.,"Drop/quarantine the sender, record telemetry, and continue the session; only local invariant corruption should be fatal.",Send invalid VV bytes from one peer in a three-peer session.,Import/anti-entropy must be resilient to peer input.,https://github.com/realartists-gitmo/flowstate/blob/0d0ecea88c71f90ddf6cc266da028242c8366646/crates/flowstate/src/collab/session.rs#L380-L450,Unchanged,The latest two commits do not modify the code establishing this finding.,9cb8ad8add47db2e3cefd611053a8d99e4ce4048
FS-066,High,Confirmed-static,Remote import / robustness,crates/flowstate/src/collab/session_io.rs,47-88,Any remote Loro import error is escalated to session failure.,A corrupt or incompatible update from one peer disconnects everyone locally.,"Reject the update, isolate the sender, and request a verified snapshot/update from another peer.",Send malformed update bytes while another peer remains healthy.,Remote updates should be accepted/rejected without destroying runtime liveness.,https://github.com/realartists-gitmo/flowstate/blob/0d0ecea88c71f90ddf6cc266da028242c8366646/crates/flowstate/src/collab/session_io.rs#L47-L88,Unchanged,The latest two commits do not modify the code establishing this finding.,9cb8ad8add47db2e3cefd611053a8d99e4ce4048
FS-067,High,Likely,Anti-entropy / lineage,crates/flowstate-collab/src/net/anti_entropy.rs,90-121,Lineage mismatch is represented as a global GapAction rather than a peer-scoped quarantine policy.,A wrong-session digest can become a session-wide failure in the app layer.,Treat mismatch as invalid input from that endpoint; never mutate or detach the local session.,Inject a digest with another SessionId.,"Document lineage validation is required, but peer faults should remain isolated.",https://github.com/realartists-gitmo/flowstate/blob/0d0ecea88c71f90ddf6cc266da028242c8366646/crates/flowstate-collab/src/net/anti_entropy.rs#L90-L121,Unchanged,The latest two commits do not modify the code establishing this finding.,9cb8ad8add47db2e3cefd611053a8d99e4ce4048
FS-068,Critical,Confirmed-static,Direct protocol / memory safety,crates/flowstate-collab/src/net/direct.rs,300-390,Direct payload reads trust a peer-declared u64 length and allocate before semantic validation.,A remote endpoint can request an arbitrarily large allocation and terminate the process.,Enforce protocol-specific maximum lengths before allocation; stream large payloads to bounded storage and use timeouts.,Send a length prefix near u64::MAX without a body.,Network input must be bounded before allocation.,https://github.com/realartists-gitmo/flowstate/blob/0d0ecea88c71f90ddf6cc266da028242c8366646/crates/flowstate-collab/src/net/direct.rs#L300-L390,Unchanged,The latest two commits do not modify the code establishing this finding.,9cb8ad8add47db2e3cefd611053a8d99e4ce4048
FS-069,High,Confirmed-static,Direct protocol / liveness,crates/flowstate-collab/src/net/direct.rs,90-180,A request handler can wait indefinitely for the application/runtime response while holding a serving permit.,Slow or wedged local handling lets remote clients exhaust service capacity.,Add per-request deadlines and cancellation; release permits before long app work when possible.,Never answer a direct request and open four more.,Runtime/network isolation requires bounded waits.,https://github.com/realartists-gitmo/flowstate/blob/0d0ecea88c71f90ddf6cc266da028242c8366646/crates/flowstate-collab/src/net/direct.rs#L90-L180,Unchanged,The latest two commits do not modify the code establishing this finding.,9cb8ad8add47db2e3cefd611053a8d99e4ce4048
FS-070,Medium,Confirmed-static,Direct protocol / fairness,crates/flowstate-collab/src/net/direct.rs,40-90,Only a small global semaphore protects all direct serving.,A few slow requests in one session can starve all other sessions and message types.,Use per-peer/per-session quotas plus a larger global safety cap.,Open slow requests from one peer and test another session.,P2P resilience should avoid cross-session head-of-line blocking.,https://github.com/realartists-gitmo/flowstate/blob/0d0ecea88c71f90ddf6cc266da028242c8366646/crates/flowstate-collab/src/net/direct.rs#L40-L90,Unchanged,The latest two commits do not modify the code establishing this finding.,9cb8ad8add47db2e3cefd611053a8d99e4ce4048
FS-071,High,Confirmed-static,Gossip / liveness,crates/flowstate-collab/src/net/swarm.rs,180-300,A gossip publish error exits the entire swarm task.,Transient oversize/backpressure/network failures kill collaboration instead of degrading one message.,"Classify publish errors, retry/backoff transient failures, drop only the bad message, and keep the swarm loop alive.",Force one publish failure and observe subsequent traffic.,Periodic digest is fallback liveness; the transport loop must survive errors.,https://github.com/realartists-gitmo/flowstate/blob/0d0ecea88c71f90ddf6cc266da028242c8366646/crates/flowstate-collab/src/net/swarm.rs#L180-L300,Unchanged,The latest two commits do not modify the code establishing this finding.,9cb8ad8add47db2e3cefd611053a8d99e4ce4048
FS-072,High,Confirmed-static,Presence / transport,crates/flowstate-collab/src/proto_gossip.rs,1-120,Presence uses inline gossip payloads with a small limit.,Long display names or encoded presence state can exceed the cap; combined with fatal publish handling this kills the swarm.,"Bound/sanitize names and selection payloads, or use a separate capped presence encoding with graceful drop.",Set a very long display name and publish presence.,Presence is ephemeral and must never endanger document synchronization.,https://github.com/realartists-gitmo/flowstate/blob/0d0ecea88c71f90ddf6cc266da028242c8366646/crates/flowstate-collab/src/proto_gossip.rs#L1-L120,Partially mitigated; remains open,"Presence snapshots now publish only the local peer state instead of encode_all, and external-caret work is debounced. Individual presence payloads, display names, the inline gossip limit, and fatal swarm publish behavior remain unchanged.",9cb8ad8add47db2e3cefd611053a8d99e4ce4048
FS-073,Medium,Lead,Anti-entropy / size,crates/flowstate-collab/src/proto_gossip.rs,1-160,Version-vector digest size is not clearly bounded against transport limits.,Long-lived/high-replica documents may produce oversized digest messages.,Define maximum digest size and a fallback direct digest/snapshot negotiation.,Create thousands of replica entries and encode a digest.,Anti-entropy must scale with durable history.,https://github.com/realartists-gitmo/flowstate/blob/0d0ecea88c71f90ddf6cc266da028242c8366646/crates/flowstate-collab/src/proto_gossip.rs#L1-L160,Unchanged,The latest two commits do not modify the code establishing this finding.,9cb8ad8add47db2e3cefd611053a8d99e4ce4048
FS-074,High,Confirmed-static,Network runtime / memory,crates/flowstate-collab/src/net/runtime.rs,40-160,Network command and event channels are unbounded.,"A blocked UI or slow network task can accumulate unlimited updates, presence events, blob requests, and status messages.","Use bounded channels, coalesce presence/digests, and apply backpressure to document-update producers.",Pause event consumption and flood updates.,Networking should not create unbounded process memory.,https://github.com/realartists-gitmo/flowstate/blob/0d0ecea88c71f90ddf6cc266da028242c8366646/crates/flowstate-collab/src/net/runtime.rs#L40-L160,Unchanged,The latest two commits do not modify the code establishing this finding.,9cb8ad8add47db2e3cefd611053a8d99e4ce4048
FS-075,High,Confirmed-static,Blob outbox,crates/flowstate-collab/src/net/blobs.rs,1-180,A single blob larger than the outbox byte cap is inserted and then immediately evicted.,Peers receive an announcement for content the sender can no longer serve.,Reject oversize blobs before announcing or store them in a persistent/streaming content-addressed store.,Publish an update just above the byte cap.,Large updates/assets need reliable out-of-band availability.,https://github.com/realartists-gitmo/flowstate/blob/0d0ecea88c71f90ddf6cc266da028242c8366646/crates/flowstate-collab/src/net/blobs.rs#L1-L180,Unchanged,The latest two commits do not modify the code establishing this finding.,9cb8ad8add47db2e3cefd611053a8d99e4ce4048
FS-076,Medium,Likely,Blob transfer / retention,crates/flowstate-collab/src/net/blobs.rs,80-220,Rapid blob churn can evict content before slow peers request it.,Peers stall until periodic anti-entropy reconstructs another route.,"Retain until acknowledgement/expiry, pin latest document updates, or serve from package journal/content store.",Throttle a peer and publish many blobs.,Asset/update availability is part of sync status.,https://github.com/realartists-gitmo/flowstate/blob/0d0ecea88c71f90ddf6cc266da028242c8366646/crates/flowstate-collab/src/net/blobs.rs#L80-L220,Unchanged,The latest two commits do not modify the code establishing this finding.,9cb8ad8add47db2e3cefd611053a8d99e4ce4048
FS-077,High,Confirmed-static,Anti-entropy / liveness,crates/flowstate-collab/src/net/anti_entropy.rs,27-136,One global `pull_in_flight` flag blocks pulls from all peers.,A hung pull prevents recovery from healthier peers indefinitely.,"Track pulls by peer/range, add deadlines, and allow fallback to another candidate.","Start a pull from an unresponsive peer, then advertise missing ops from another.",Immediate anti-entropy must remain live under peer failure.,https://github.com/realartists-gitmo/flowstate/blob/0d0ecea88c71f90ddf6cc266da028242c8366646/crates/flowstate-collab/src/net/anti_entropy.rs#L27-L136,Unchanged,The latest two commits do not modify the code establishing this finding.,9cb8ad8add47db2e3cefd611053a8d99e4ce4048
FS-078,Medium,Lead,Anti-entropy / peer choice,crates/flowstate-collab/src/net/anti_entropy.rs,79-88,Lag recovery uses one fallback peer and has no immediate alternate selection in this state object.,Recovery waits on a poor candidate even when other peers are available.,Rank multiple candidates and rotate on timeout/failure.,"Lag with two peers, make the selected fallback unavailable.",P2P recovery should use available redundancy.,https://github.com/realartists-gitmo/flowstate/blob/0d0ecea88c71f90ddf6cc266da028242c8366646/crates/flowstate-collab/src/net/anti_entropy.rs#L79-L88,Unchanged,The latest two commits do not modify the code establishing this finding.,9cb8ad8add47db2e3cefd611053a8d99e4ce4048
FS-079,High,Likely,Presence / authenticity,crates/flowstate-collab/src/presence.rs,119-175,Presence-state keys are accepted from encoded ephemeral updates without binding them to the authenticated sender endpoint.,A session member may spoof another participant's name/caret/color key.,Wrap presence updates in sender-authenticated envelopes and reject states for keys not derived from the transport sender.,Have peer B publish an encoded state under peer A's key.,"Presence is ephemeral, but peer identity must remain trustworthy.",https://github.com/realartists-gitmo/flowstate/blob/0d0ecea88c71f90ddf6cc266da028242c8366646/crates/flowstate-collab/src/presence.rs#L119-L175,Partially mitigated; remains open,Publishing encode_self prevents an honest peer from rebroadcasting all remote roster states. Inbound ephemeral state keys are still not cryptographically/transport-bound to the sending endpoint.,9cb8ad8add47db2e3cefd611053a8d99e4ce4048
FS-080,Medium,Lead,Session authorization,crates/flowstate-collab/src/ticket.rs,11-59,"Session tickets contain no expiry, capability, role, or revocation data.",A copied bearer ticket may remain usable for the session lifetime with editor-level access determined elsewhere.,"Define signed capabilities/roles, optional expiry, and host revocation/rotation.",Reuse an old ticket after role change or host restart.,The architecture defines roles/users but needs an authorization trust model.,https://github.com/realartists-gitmo/flowstate/blob/0d0ecea88c71f90ddf6cc266da028242c8366646/crates/flowstate-collab/src/ticket.rs#L11-L59,Unchanged,The latest two commits do not modify the code establishing this finding.,9cb8ad8add47db2e3cefd611053a8d99e4ce4048
FS-081,Low,Confirmed-static,Protocol diagnostics,crates/flowstate-collab/src/ids.rs,67-90,SessionId parser accepts uppercase hex while the error says lowercase is required.,Diagnostics and canonical ticket expectations disagree.,Either reject uppercase or change the message.,Parse uppercase A-F.,Low-risk protocol consistency issue.,https://github.com/realartists-gitmo/flowstate/blob/0d0ecea88c71f90ddf6cc266da028242c8366646/crates/flowstate-collab/src/ids.rs#L67-L90,Unchanged,The latest two commits do not modify the code establishing this finding.,9cb8ad8add47db2e3cefd611053a8d99e4ce4048
FS-082,Positive,Implemented,Assets / integrity,crates/flowstate/src/collab/asset_transfer.rs,120-260,Received assets are checked against expected byte length and BLAKE3 hash.,This prevents accidental/corrupt asset attachment.,Retain and add size caps before allocation/download.,No defect; adversarially test mismatch handling.,Matches canonical BLAKE3 asset addressing.,https://github.com/realartists-gitmo/flowstate/blob/0d0ecea88c71f90ddf6cc266da028242c8366646/crates/flowstate/src/collab/asset_transfer.rs#L120-L260,Unchanged,The latest two commits do not modify the code establishing this finding.,9cb8ad8add47db2e3cefd611053a8d99e4ce4048
FS-083,Positive,Implemented,Anti-entropy,crates/flowstate/src/collab/session_io.rs,47-110,Pending/missing import dependencies trigger immediate anti-entropy work.,The design does not rely only on periodic digest.,Keep this path while making failures peer-scoped and time-bounded.,No defect; retain behavior.,Matches the anti-entropy requirement.,https://github.com/realartists-gitmo/flowstate/blob/0d0ecea88c71f90ddf6cc266da028242c8366646/crates/flowstate/src/collab/session_io.rs#L47-L110,Unchanged,The latest two commits do not modify the code establishing this finding.,9cb8ad8add47db2e3cefd611053a8d99e4ce4048
FS-084,Critical,Confirmed-static,Projection diff,crates/flowstate-collab/src/crdt_runtime/projection_patch.rs,15-47,"When block IDs form a single move, the diff emits only MoveBlock.",Text/style/object changes in the same canonical commit are omitted.,"After structural detection, also diff all retained blocks, or derive patches directly from the Loro event batch.",Move a block and edit its content in one grouped change.,A projection event must represent the complete frontier transition.,https://github.com/realartists-gitmo/flowstate/blob/0d0ecea88c71f90ddf6cc266da028242c8366646/crates/flowstate-collab/src/crdt_runtime/projection_patch.rs#L15-L47,Unchanged,The latest two commits do not modify the code establishing this finding.,9cb8ad8add47db2e3cefd611053a8d99e4ce4048
FS-085,Critical,Confirmed-static,Projection diff,crates/flowstate-collab/src/crdt_runtime/projection_patch.rs,31-47,Insert/delete structural diffs omit changes to retained prefix and suffix blocks.,A commit that inserts a block and edits existing content produces an incomplete UI update.,Diff unchanged-ID regions before/after the structural middle or fall back to a full snapshot.,Insert an object and edit a paragraph in one transaction.,Batched frontier invalidation must be complete.,https://github.com/realartists-gitmo/flowstate/blob/0d0ecea88c71f90ddf6cc266da028242c8366646/crates/flowstate-collab/src/crdt_runtime/projection_patch.rs#L31-L47,Unchanged,The latest two commits do not modify the code establishing this finding.,9cb8ad8add47db2e3cefd611053a8d99e4ce4048
FS-086,High,Confirmed-static,Projection diff / performance,crates/flowstate-collab/src/crdt_runtime/projection_patch.rs,202-217,Single-block-move detection is cubic and repeatedly clones vectors.,Large documents can freeze on common reorder diffs.,Use an O(n) position map/permutation check.,Benchmark one move in 10k and 100k blocks.,Incremental projection is intended to improve responsiveness.,https://github.com/realartists-gitmo/flowstate/blob/0d0ecea88c71f90ddf6cc266da028242c8366646/crates/flowstate-collab/src/crdt_runtime/projection_patch.rs#L202-L217,Unchanged,The latest two commits do not modify the code establishing this finding.,9cb8ad8add47db2e3cefd611053a8d99e4ce4048
FS-087,High,Confirmed-static,Projection diff / objects,crates/flowstate-collab/src/crdt_runtime/projection_patch.rs,74-112,"Object patch comparison pairs objects after sorting by ID, not canonical body order/reachability.","Registry/projection mismatches force fallback, and unreachable objects contaminate comparison.",Build object patches from reachable placeholder anchors and durable block IDs in body order.,Move/delete objects while leaving historical registry entries.,Body flow is canonical for object order.,https://github.com/realartists-gitmo/flowstate/blob/0d0ecea88c71f90ddf6cc266da028242c8366646/crates/flowstate-collab/src/crdt_runtime/projection_patch.rs#L74-L112,Unchanged,The latest two commits do not modify the code establishing this finding.,9cb8ad8add47db2e3cefd611053a8d99e4ce4048
FS-088,Medium,Confirmed-static,Projection diff / granularity,crates/gpui-flowtext/src/rich_text/editor/projection_apply.rs,92-140,ReplaceObjectBlock causes a full document structural rebuild.,Small caption/source/cell changes invalidate all paragraphs and transient state.,Patch object fields and nested-flow projections directly by durable block ID.,Edit one equation character in a large document.,Full rebuild should be exceptional.,https://github.com/realartists-gitmo/flowstate/blob/0d0ecea88c71f90ddf6cc266da028242c8366646/crates/gpui-flowtext/src/rich_text/editor/projection_apply.rs#L92-L140,Unchanged,The latest two commits do not modify the code establishing this finding.,9cb8ad8add47db2e3cefd611053a8d99e4ce4048
FS-089,Medium,Confirmed-static,Projection observability,crates/flowstate-collab/src/crdt_runtime/types.rs,194-218,"Fallback counters exist, but several ordinary structural paths inherently fall back.",Telemetry may reveal the problem but does not prevent frequent full rebuilds.,Set service-level thresholds and treat repeated fallback during normal operations as an error in tests/telemetry.,"Measure typing, image, equation, and table scenarios.",Matches the plan's observability intent but not its performance target.,https://github.com/realartists-gitmo/flowstate/blob/0d0ecea88c71f90ddf6cc266da028242c8366646/crates/flowstate-collab/src/crdt_runtime/types.rs#L194-L218,Unchanged,The latest two commits do not modify the code establishing this finding.,9cb8ad8add47db2e3cefd611053a8d99e4ce4048
FS-090,Medium,Confirmed-static,Editor / layout invalidation,crates/gpui-flowtext/src/rich_text/editor/projection_apply.rs,80-89,ParagraphRuns patches rebuild document sections.,Inline style-only changes trigger unrelated outline work.,Do not rebuild outline/sections unless paragraph semantic style or structure changed.,Apply underline/highlight repeatedly in a large outline.,Projection invalidation should be narrowly scoped.,https://github.com/realartists-gitmo/flowstate/blob/0d0ecea88c71f90ddf6cc266da028242c8366646/crates/gpui-flowtext/src/rich_text/editor/projection_apply.rs#L80-L89,Unchanged,The latest two commits do not modify the code establishing this finding.,9cb8ad8add47db2e3cefd611053a8d99e4ce4048
FS-091,High,Confirmed-static,Projection consistency,crates/flowstate-collab/src/crdt_runtime/projection_patch.rs,210-247,Incremental body parsing and full projection have different object behavior.,A forced fallback can visibly rearrange paragraphs around objects after apparently successful incremental edits.,Use one parser/data model for both paths.,Compare hashes before and after forced full rebuild at the same frontier.,All projections of one frontier must be identical.,https://github.com/realartists-gitmo/flowstate/blob/0d0ecea88c71f90ddf6cc266da028242c8366646/crates/flowstate-collab/src/crdt_runtime/projection_patch.rs#L210-L247,Unchanged,The latest two commits do not modify the code establishing this finding.,9cb8ad8add47db2e3cefd611053a8d99e4ce4048
FS-092,Medium,Lead,Coordinate units,crates/flowstate-collab/src/crdt_runtime/types.rs,200-225,Invalidation ranges use Unicode positions while UI deltas use UTF-8 byte lengths.,The split is intentional in places but easy to misuse across APIs and can break non-ASCII caret mapping.,Encode units in type names/newtypes and forbid raw usize crossing boundaries.,Property-test random Unicode edits and cursor transforms.,Projection-local coordinate systems must be explicit.,https://github.com/realartists-gitmo/flowstate/blob/0d0ecea88c71f90ddf6cc266da028242c8366646/crates/flowstate-collab/src/crdt_runtime/types.rs#L200-L225,Unchanged,The latest two commits do not modify the code establishing this finding.,9cb8ad8add47db2e3cefd611053a8d99e4ce4048
FS-093,Medium,Confirmed-static,Projection diff / caret mapping,crates/flowstate-collab/src/crdt_runtime/projection_patch.rs,238-307,Remote text diff reduces the entire change to one common-prefix/common-suffix replacement.,Multi-range edits in one commit produce coarse caret remapping and excessive invalidation.,Use Loro text deltas/event ranges directly and preserve multiple edits.,Apply two distant edits in one remote transaction.,Batched event processing should retain precise changed ranges.,https://github.com/realartists-gitmo/flowstate/blob/0d0ecea88c71f90ddf6cc266da028242c8366646/crates/flowstate-collab/src/crdt_runtime/projection_patch.rs#L238-L307,Unchanged,The latest two commits do not modify the code establishing this finding.,9cb8ad8add47db2e3cefd611053a8d99e4ce4048
FS-094,Medium,Confirmed-static,Editor / structural performance,crates/gpui-flowtext/src/rich_text/editor/projection_apply.rs,104-140,One structural patch invalidates all paragraph layout.,Object insertion/deletion/move scales with full-document layout and cache rebuilding.,"Invalidate only affected block rows, neighboring paragraph layout, and pagination ranges.",Insert an image in a 50k-paragraph document.,Incremental projection should preserve responsiveness.,https://github.com/realartists-gitmo/flowstate/blob/0d0ecea88c71f90ddf6cc266da028242c8366646/crates/gpui-flowtext/src/rich_text/editor/projection_apply.rs#L104-L140,Unchanged,The latest two commits do not modify the code establishing this finding.,9cb8ad8add47db2e3cefd611053a8d99e4ce4048
FS-095,High,Likely,Package parser / memory,crates/flowstate-document/src/package.rs,860-1040,Package decoding trusts file-provided chunk counts and lengths enough to drive large allocations.,A malformed or hostile .db8 can exhaust memory before semantic validation.,Set global file/chunk/count/asset limits and stream/seek chunks instead of allocating all payloads.,Fuzz count/length fields near usize/u64 limits.,The custom container needs defensive partial reads.,https://github.com/realartists-gitmo/flowstate/blob/0d0ecea88c71f90ddf6cc266da028242c8366646/crates/flowstate-document/src/package.rs#L860-L1040,Unchanged,The latest two commits do not modify the code establishing this finding.,9cb8ad8add47db2e3cefd611053a8d99e4ce4048
FS-096,High,Lead,Package parser / complexity,crates/flowstate-document/src/package.rs,860-1120,Postcard decoding has no explicit nesting/string/container resource limits.,Hostile metadata can cause excessive allocation or CPU even when outer chunks are bounded.,Use bounded decoding wrappers or validate encoded lengths before deserialization.,Coverage-guided fuzz package manifests and indexes.,External document files are untrusted input.,https://github.com/realartists-gitmo/flowstate/blob/0d0ecea88c71f90ddf6cc266da028242c8366646/crates/flowstate-document/src/package.rs#L860-L1120,Unchanged,The latest two commits do not modify the code establishing this finding.,9cb8ad8add47db2e3cefd611053a8d99e4ce4048
FS-097,Medium,Likely,Package integrity,crates/flowstate-document/src/package.rs,1060-1220,Integrity-index validation may not enforce one-to-one uniqueness between index entries and durable chunks.,Duplicate entries could satisfy count/membership checks while another chunk is omitted.,"Validate uniqueness by `(kind,id)` and exact set equality.",Construct duplicate index entries with one missing chunk.,Integrity index must cover every durable chunk exactly once.,https://github.com/realartists-gitmo/flowstate/blob/0d0ecea88c71f90ddf6cc266da028242c8366646/crates/flowstate-document/src/package.rs#L1060-L1220,Unchanged,The latest two commits do not modify the code establishing this finding.,9cb8ad8add47db2e3cefd611053a8d99e4ce4048
