ID,Severity,Status,Area,File,Lines,Finding,Impact,Fix direction,Verification,Architecture relation,Permalink,Latest review status,Latest review note,Reviewed head
FS-032,High,Confirmed-static,Package compaction,crates/flowstate-document/src/package.rs,603-637,Compaction clears update segments and prunes snapshots before all cache rebuild work succeeds.,A later error leaves the in-memory package partially compacted.,"Perform compaction on a clone and commit the clone only after snapshot, caches, indexes, and validation all succeed.",Inject search/projection cache rebuild failures.,Compaction must preserve named revisions and latest state atomically.,https://github.com/realartists-gitmo/flowstate/blob/0d0ecea88c71f90ddf6cc266da028242c8366646/crates/flowstate-document/src/package.rs#L603-L637,Unchanged,The latest two commits do not modify the code establishing this finding.,9cb8ad8add47db2e3cefd611053a8d99e4ce4048
FS-033,High,Confirmed-static,Tables / concurrency,crates/flowstate-collab/src/crdt_runtime.rs,2860-3260,Generic table replacement clears and repopulates row/column/cell containers.,Normal table edits lose granular CRDT history and turn concurrent structural edits into broad conflicts.,Implement dedicated row/column/cell commands over durable IDs and mutate only affected containers.,Edit different cells/rows concurrently while another peer resizes or moves a column.,Tables must be structurally CRDT-native and not rewritten wholesale.,https://github.com/realartists-gitmo/flowstate/blob/0d0ecea88c71f90ddf6cc266da028242c8366646/crates/flowstate-collab/src/crdt_runtime.rs#L2860-L3260,Unchanged,The latest two commits do not modify the code establishing this finding.,9cb8ad8add47db2e3cefd611053a8d99e4ce4048
FS-034,High,Confirmed-static,Nested text / concurrency,crates/flowstate-collab/src/crdt_runtime.rs,3260-3620,"Alt text, captions, equation source, and table-cell edits use whole-flow replacement paths.",Concurrent character-level edits can overwrite each other instead of merging naturally.,Expose cursor/range text commands for every nested flow and apply LoroText insert/delete/mark operations.,Concurrent-edit distinct positions in each nested flow.,These fields are required to be independent CRDT text flows.,https://github.com/realartists-gitmo/flowstate/blob/0d0ecea88c71f90ddf6cc266da028242c8366646/crates/flowstate-collab/src/crdt_runtime.rs#L3260-L3620,Unchanged,The latest two commits do not modify the code establishing this finding.,9cb8ad8add47db2e3cefd611053a8d99e4ce4048
FS-035,High,Confirmed-static,Tables / identity,crates/flowstate-collab/src/crdt_runtime.rs,2300-2860,"Table editor commands address rows, columns, and cells by numeric index.",Concurrent reorder/insert/delete can make a stale command target the wrong entity.,"Carry durable RowId, ColumnId, CellId and a base frontier/cursor in every semantic command.",Reorder a column remotely while a local cell edit is queued.,Rows/columns/cells require durable Loro-native identity.,https://github.com/realartists-gitmo/flowstate/blob/0d0ecea88c71f90ddf6cc266da028242c8366646/crates/flowstate-collab/src/crdt_runtime.rs#L2300-L2860,Unchanged,The latest two commits do not modify the code establishing this finding.,9cb8ad8add47db2e3cefd611053a8d99e4ce4048
FS-036,High,Likely,Text deletion / objects,crates/flowstate-collab/src/crdt_runtime.rs,1026-1058,The low-level DeleteRange path can delete sentinel/newline/object characters without first pruning or repairing related metadata.,"It can leave orphaned block maps, paragraph maps, sections, or an invalid sentinel.",Reject structural deletion through generic text commands; use semantic join/delete-object commands that update all metadata in one transaction.,"Delete across the sentinel, newline, and U+FFFC through direct runtime API and editor-generated ranges.",Structural characters are not ordinary user text.,https://github.com/realartists-gitmo/flowstate/blob/0d0ecea88c71f90ddf6cc266da028242c8366646/crates/flowstate-collab/src/crdt_runtime.rs#L1026-L1058,Unchanged,The latest two commits do not modify the code establishing this finding.,9cb8ad8add47db2e3cefd611053a8d99e4ce4048
FS-037,High,Lead,Paragraph replacement / objects,crates/gpui-flowtext/src/rich_text/editor/edit_pipeline.rs,193-276,ReplaceParagraphSpan is derived from paragraph-only spans and may cross object boundaries represented separately in the body flow.,A replacement around object-adjacent paragraphs may remove or relocate structural placeholders unintentionally.,"Build semantic ranges from canonical flow cursors including object affinity, not reconstructed paragraph snapshots.",Paste/replace selections spanning text-object-text.,Canonical command positions should use Loro cursors wherever possible.,https://github.com/realartists-gitmo/flowstate/blob/0d0ecea88c71f90ddf6cc266da028242c8366646/crates/gpui-flowtext/src/rich_text/editor/edit_pipeline.rs#L193-L276,Unchanged,The latest two commits do not modify the code establishing this finding.,9cb8ad8add47db2e3cefd611053a8d99e4ce4048
FS-038,Medium,Confirmed-static,Runtime indexes,crates/flowstate-collab/src/crdt_runtime.rs,368-436,Incremental index maintenance only shifts paragraph and placeholder positions.,"Style, search, table, section, asset, and durable-ID indexes can remain stale after patches that do not trigger a rebuild.",Define per-patch updates for every index or conservatively rebuild affected indexes.,Compare every index with a freshly rebuilt runtime index after random patch sequences.,The plan requires explicit projection indexes with reliable invalidation.,https://github.com/realartists-gitmo/flowstate/blob/0d0ecea88c71f90ddf6cc266da028242c8366646/crates/flowstate-collab/src/crdt_runtime.rs#L368-L436,Partially fixed; remains open,"Text-length patches now update search_unit_spans as well as paragraph/object positions. The runtime still ignores ParagraphRuns, ParagraphStyle, ReplaceObjectBlock, and AssetArrived for the affected auxiliary indexes, so style/table/asset/identity indexes can remain stale.",9cb8ad8add47db2e3cefd611053a8d99e4ce4048
FS-039,Medium,Confirmed-static,Runtime actor / memory,crates/flowstate-collab/src/crdt_runtime_actor.rs,70-110,The CRDT actor command channel is unbounded.,"A blocked runtime can accumulate unlimited edits, imports, assets, saves, and exports.",Use bounded channels with backpressure and prioritize shutdown/import/control messages.,Pause actor processing and flood commands.,"Dedicated runtime ownership should isolate work, not create unbounded queues.",https://github.com/realartists-gitmo/flowstate/blob/0d0ecea88c71f90ddf6cc266da028242c8366646/crates/flowstate-collab/src/crdt_runtime_actor.rs#L70-L110,Unchanged,The latest two commits do not modify the code establishing this finding.,9cb8ad8add47db2e3cefd611053a8d99e4ce4048
FS-040,Medium,Lead,Loro subscriptions,crates/flowstate-collab/src/crdt_runtime.rs,567-604,Subscription summaries and local update byte vectors are unbounded between drains.,Canonical mutations outside ordinary command drains can grow buffers indefinitely.,"Bound buffers, coalesce summaries by frontier/container, and log dropped/coalesced counts.",Generate metadata commits without calling the normal event drain.,Permanent subscriptions need bounded processing.,https://github.com/realartists-gitmo/flowstate/blob/0d0ecea88c71f90ddf6cc266da028242c8366646/crates/flowstate-collab/src/crdt_runtime.rs#L567-L604,Unchanged,The latest two commits do not modify the code establishing this finding.,9cb8ad8add47db2e3cefd611053a8d99e4ce4048
FS-041,Medium,Confirmed-static,Undo input,crates/flowstate-collab/src/crdt_runtime_actor.rs,500-545,Undo/redo forwarding uses non-blocking bounded sends that can drop requests.,Rapid user input can silently lose undo or redo actions.,Disable UI while one undo is in flight or enqueue with an explicit acknowledgement/error.,Hold the actor and press undo repeatedly.,Undo is user-visible state and must not be silently dropped.,https://github.com/realartists-gitmo/flowstate/blob/0d0ecea88c71f90ddf6cc266da028242c8366646/crates/flowstate-collab/src/crdt_runtime_actor.rs#L500-L545,Unchanged,The latest two commits do not modify the code establishing this finding.,9cb8ad8add47db2e3cefd611053a8d99e4ce4048
FS-042,Positive,Implemented,Runtime ownership,crates/flowstate-collab/src/crdt_runtime.rs,483-620,"The runtime owns LoroDoc, UndoManager, permanent subscriptions, package state, and projection.",This is the correct core ownership direction.,Keep this boundary while fixing transactionality and event routing.,No defect; retain architecture.,Matches the dedicated CRDT runtime requirement.,https://github.com/realartists-gitmo/flowstate/blob/0d0ecea88c71f90ddf6cc266da028242c8366646/crates/flowstate-collab/src/crdt_runtime.rs#L483-L620,Unchanged,The latest two commits do not modify the code establishing this finding.,9cb8ad8add47db2e3cefd611053a8d99e4ce4048
FS-043,Positive,Implemented,Selection / cursors,crates/gpui-flowtext/src/document/position.rs,17-71,Selection affinity and visual gravity are explicit stored fields.,Caret intent can survive collaboration and undo instead of being guessed from direction.,Add full bidi behavior and more boundary tests.,No defect; test concurrent same-position insertion and wrapping.,Matches the selection-affinity requirement.,https://github.com/realartists-gitmo/flowstate/blob/0d0ecea88c71f90ddf6cc266da028242c8366646/crates/gpui-flowtext/src/document/position.rs#L17-L71,Implementation strengthened,Presence and undo now construct stable boundary cursors from the preceding/following text element; remote cursor resolution uses Event→Unicode conversion and preserves visual gravity. Two focused tests were added.,9cb8ad8add47db2e3cefd611053a8d99e4ce4048
FS-044,Medium,Lead,Selection / bidi,crates/gpui-flowtext/src/document/position.rs,63-65,RTL/bidi gravity is explicitly simplified to neutral behavior.,Caret restoration and collaborative selection can be visually wrong in bidirectional text.,Integrate bidi-resolved visual positions into affinity/gravity mapping.,Add Arabic/Hebrew mixed-line collaboration and undo tests.,The target selection model calls out bidi behavior.,https://github.com/realartists-gitmo/flowstate/blob/0d0ecea88c71f90ddf6cc266da028242c8366646/crates/gpui-flowtext/src/document/position.rs#L63-L65,Unchanged,The latest two commits do not modify the code establishing this finding.,9cb8ad8add47db2e3cefd611053a8d99e4ce4048
FS-045,Critical,Confirmed-static,Workspace / event routing,crates/flowstate/src/workspace/workspace/documents.rs,360-455,"Native save, export, and undo hooks discard RuntimeEvents returned by command application.","LocalUpdate, repair patches, selection restoration, and other events can vanish depending on which UI action flushed pending edits.","Centralize all runtime calls through one event dispatcher that always applies projection events, publishes LocalUpdate, and updates session state.","Type without normal flush, then immediately save/export/undo in a live session.",There must be one local mutation/event path.,https://github.com/realartists-gitmo/flowstate/blob/0d0ecea88c71f90ddf6cc266da028242c8366646/crates/flowstate/src/workspace/workspace/documents.rs#L360-L455,Unchanged,The latest two commits do not modify the code establishing this finding.,9cb8ad8add47db2e3cefd611053a8d99e4ce4048
FS-046,High,Confirmed-static,Save / collaboration,crates/flowstate/src/workspace/workspace/documents.rs,360-455,Checkpoint LocalUpdate events are not directly forwarded by save hooks.,"Peers learn about revision/checkpoint metadata only through later digest recovery, and may miss it if the session closes.",Publish every LocalUpdate returned by checkpoint before reporting save success.,Save and immediately close the host while a peer remains connected.,Canonical revision metadata must synchronize like other Loro updates.,https://github.com/realartists-gitmo/flowstate/blob/0d0ecea88c71f90ddf6cc266da028242c8366646/crates/flowstate/src/workspace/workspace/documents.rs#L360-L455,Unchanged,The latest two commits do not modify the code establishing this finding.,9cb8ad8add47db2e3cefd611053a8d99e4ce4048
FS-047,Critical,Confirmed-static,Collaboration / failure handling,crates/flowstate/src/collab/session.rs,880-970,Any local runtime error during flush detaches the whole collaboration session.,"A disk error, malformed command, or partial batch failure destroys the active session and can strand optimistic UI state.",Classify errors: stale -> rebase; persistence -> remain connected and show durable-dirty; bad local command -> rollback/reproject; protocol lineage -> isolate peer.,Inject each error class during normal typing.,Local persistence and network liveness must not share one fatal path.,https://github.com/realartists-gitmo/flowstate/blob/0d0ecea88c71f90ddf6cc266da028242c8366646/crates/flowstate/src/collab/session.rs#L880-L970,Unchanged,The latest two commits do not modify the code establishing this finding.,9cb8ad8add47db2e3cefd611053a8d99e4ce4048
FS-048,High,Confirmed-static,Collaboration / persistence,crates/flowstate/src/collab/session.rs,880-970,Local package-write failures are treated as collaboration-fatal.,Networking is lost even though peers and in-memory CRDT may still be healthy.,Track unsaved state and retry persistence independently from the session.,Make the package path read-only during a session.,Runtime should isolate CRDT work from filesystem failures.,https://github.com/realartists-gitmo/flowstate/blob/0d0ecea88c71f90ddf6cc266da028242c8366646/crates/flowstate/src/collab/session.rs#L880-L970,Unchanged,The latest two commits do not modify the code establishing this finding.,9cb8ad8add47db2e3cefd611053a8d99e4ce4048
FS-049,High,Likely,Collaboration / detach,crates/flowstate/src/collab/session.rs,930-1040,Detach initiates an asynchronous final flush while removing runtime/session hooks immediately.,Final optimistic edits can complete after the session is gone and never be published or applied.,Make detach await an acknowledged flush or explicitly cancel and canonical-reproject before teardown.,Type and instantly leave/close under delayed runtime execution.,No user edit should be silently abandoned during lifecycle transition.,https://github.com/realartists-gitmo/flowstate/blob/0d0ecea88c71f90ddf6cc266da028242c8366646/crates/flowstate/src/collab/session.rs#L930-L1040,Unchanged,The latest two commits do not modify the code establishing this finding.,9cb8ad8add47db2e3cefd611053a8d99e4ce4048
FS-050,High,Confirmed-static,Editor / error rollback,crates/flowstate/src/collab/session.rs,880-970,Non-stale runtime errors complete the in-flight marker without restoring the editor from canonical projection.,Optimistic UI may continue showing content that was never accepted canonically.,"On any rejected batch, replace/rebase from runtime projection and restore transformed selection.",Inject invalid command after optimistic mutation.,UI projection is derived and must converge to runtime state.,https://github.com/realartists-gitmo/flowstate/blob/0d0ecea88c71f90ddf6cc266da028242c8366646/crates/flowstate/src/collab/session.rs#L880-L970,Unchanged,The latest two commits do not modify the code establishing this finding.,9cb8ad8add47db2e3cefd611053a8d99e4ce4048
FS-051,High,Likely,Editor / acknowledgement,crates/flowstate/src/workspace/workspace/documents.rs,1756-1799,The acknowledge-without-replay path assumes local optimistic projection exactly equals canonical runtime output.,"Canonical repair, normalization, or metadata-driven visible changes in the same batch can be skipped while the frontier advances.",Have the runtime label events as pure echo versus corrective projection; acknowledge only pure echoes.,Trigger a command that also repairs malformed paragraph/object metadata.,Derived projection must reflect every canonical repair.,https://github.com/realartists-gitmo/flowstate/blob/0d0ecea88c71f90ddf6cc266da028242c8366646/crates/flowstate/src/workspace/workspace/documents.rs#L1756-L1799,Unchanged,The latest two commits do not modify the code establishing this finding.,9cb8ad8add47db2e3cefd611053a8d99e4ce4048
FS-052,High,Confirmed-static,Workspace / event routing,crates/flowstate/src/workspace/workspace/documents.rs,1756-1799,Acknowledge-without-replay returns early and ignores all other event kinds.,"SelectionRestored, projection repairs, revision events, or other future event types in the batch are lost.",Filter only the local echo patch; process the remainder through the common dispatcher.,Return a batch containing LocalUpdate plus SelectionRestored/ProjectionUpdated.,Runtime event handling must be complete and centralized.,https://github.com/realartists-gitmo/flowstate/blob/0d0ecea88c71f90ddf6cc266da028242c8366646/crates/flowstate/src/workspace/workspace/documents.rs#L1756-L1799,Unchanged,The latest two commits do not modify the code establishing this finding.,9cb8ad8add47db2e3cefd611053a8d99e4ce4048
FS-053,High,Confirmed-static,Recovery,crates/gpui-flowtext/src/rich_text/editor/recovery.rs,144-247,Runtime recovery snapshots can run without first flushing pending optimistic semantic edits.,"The recovery file can omit the newest unsaved edits, then record that generation as recovered.","Recovery hook must atomically submit pending edits, await canonical acknowledgement, and snapshot that exact frontier.","Type, block the normal runtime flush, wait for recovery, then crash and restore.",Recovery must serialize canonical Loro state at the user's latest accepted edit.,https://github.com/realartists-gitmo/flowstate/blob/0d0ecea88c71f90ddf6cc266da028242c8366646/crates/gpui-flowtext/src/rich_text/editor/recovery.rs#L144-L247,Unchanged,The latest two commits do not modify the code establishing this finding.,9cb8ad8add47db2e3cefd611053a8d99e4ce4048
FS-054,Medium,Confirmed-static,Assets / dirty state,crates/gpui-flowtext/src/rich_text/editor/projection_apply.rs,5-20,Receiving out-of-band asset bytes marks the document as edited.,"A cache/availability event causes dirty indicators, autosave, recovery writes, and close prompts even when canonical metadata did not change.",Separate asset availability/cache generation from document edit generation.,"Open a document with a missing image, receive bytes, and inspect dirty state.",Asset bytes are outside Loro and availability is not a document-history edit.,https://github.com/realartists-gitmo/flowstate/blob/0d0ecea88c71f90ddf6cc266da028242c8366646/crates/gpui-flowtext/src/rich_text/editor/projection_apply.rs#L5-L20,Unchanged,The latest two commits do not modify the code establishing this finding.,9cb8ad8add47db2e3cefd611053a8d99e4ce4048
FS-055,Medium,Confirmed-static,Assets / undo,crates/flowstate/src/collab/session.rs,730-790,Applying synchronized assets clears editor undo/redo stacks.,A non-document cache arrival destroys user history.,Do not clear canonical Loro undo for asset availability. Invalidate only affected image layout/cache.,"Make edits, receive image bytes, then undo.","Undo is based on Loro document changes, not asset-transfer completion.",https://github.com/realartists-gitmo/flowstate/blob/0d0ecea88c71f90ddf6cc266da028242c8366646/crates/flowstate/src/collab/session.rs#L730-L790,Unchanged,The latest two commits do not modify the code establishing this finding.,9cb8ad8add47db2e3cefd611053a8d99e4ce4048
FS-056,High,Confirmed-static,Editor / structural patches,crates/gpui-flowtext/src/rich_text/editor/projection_apply.rs,92-140,Remote structural patches rebuild the whole visible document while local optimistic edits may be queued.,Queued local text/object state can be overwritten or selections reset.,"Rebase queued semantic edits over the new canonical frontier, or serialize remote application against speculative overlays.",Delay local runtime acknowledgement and apply a remote object insertion.,UI receives derived diffs but must preserve/rebase local intent.,https://github.com/realartists-gitmo/flowstate/blob/0d0ecea88c71f90ddf6cc266da028242c8366646/crates/gpui-flowtext/src/rich_text/editor/projection_apply.rs#L92-L140,Unchanged,The latest two commits do not modify the code establishing this finding.,9cb8ad8add47db2e3cefd611053a8d99e4ce4048
FS-057,Medium,Confirmed-static,Editor / object state,crates/gpui-flowtext/src/rich_text/editor/projection_apply.rs,104-157,Broad structural changes clear active image/table/equation editing state.,Unrelated remote structure changes interrupt local editing.,Transform selected object IDs through the patch and clear only if the selected object was deleted/replaced.,Edit a table cell while a remote user inserts an unrelated image.,Selection should be durable-ID/cursor based.,https://github.com/realartists-gitmo/flowstate/blob/0d0ecea88c71f90ddf6cc266da028242c8366646/crates/gpui-flowtext/src/rich_text/editor/projection_apply.rs#L104-L157,Unchanged,The latest two commits do not modify the code establishing this finding.,9cb8ad8add47db2e3cefd611053a8d99e4ce4048
FS-058,Medium,Lead,Editor / deferred apply,crates/gpui-flowtext/src/rich_text/editor/projection_apply.rs,51-57,"Projection apply is deferred during drag, resize, selection, and IME, but queue limits/order need explicit guarantees.",A long interaction under remote activity may accumulate stale patches or apply them after local coordinates changed.,Use a bounded frontier-aware queue and collapse to one full snapshot when the queue is superseded.,Hold IME composition/drag while flooding remote updates.,Projection batching must be frontier-scoped.,https://github.com/realartists-gitmo/flowstate/blob/0d0ecea88c71f90ddf6cc266da028242c8366646/crates/gpui-flowtext/src/rich_text/editor/projection_apply.rs#L51-L57,Unchanged,The latest two commits do not modify the code establishing this finding.,9cb8ad8add47db2e3cefd611053a8d99e4ce4048
FS-059,Medium,Confirmed-static,Editor lifecycle,crates/gpui-flowtext/src/rich_text/editor/lifecycle.rs,330-352,Disabling runtime capture resets the in-flight count without cancelling callbacks or changing an epoch.,A late callback can mutate an editor after route/session transition.,Attach a capture epoch/token to every request and ignore late completions from older epochs.,Disable capture while a delayed save/edit request is in flight.,Runtime lifecycle needs explicit ownership epochs.,https://github.com/realartists-gitmo/flowstate/blob/0d0ecea88c71f90ddf6cc266da028242c8366646/crates/gpui-flowtext/src/rich_text/editor/lifecycle.rs#L330-L352,Unchanged,The latest two commits do not modify the code establishing this finding.,9cb8ad8add47db2e3cefd611053a8d99e4ce4048
FS-060,Medium,Lead,Undo transition,crates/gpui-flowtext/src/rich_text/editor/lifecycle.rs,369-377,The editor retains a separate local undo stack whenever command capture is temporarily disabled.,A lifecycle gap can create edits in the wrong undo system.,"Once a Loro runtime is attached, disable projection-native document history permanently; use a speculative overlay only.",Edit during attach/detach and startup transitions.,Undo must be Loro-native for all documents.,https://github.com/realartists-gitmo/flowstate/blob/0d0ecea88c71f90ddf6cc266da028242c8366646/crates/gpui-flowtext/src/rich_text/editor/lifecycle.rs#L369-L377,Unchanged,The latest two commits do not modify the code establishing this finding.,9cb8ad8add47db2e3cefd611053a8d99e4ce4048
FS-061,High,Likely,Autosave / event routing,crates/flowstate/src/workspace/workspace/documents.rs,1450-1464,Autosave directly invokes editor save while live edit flushing is independently scheduled.,"Even with actor serialization, pending commands and returned events can be consumed by the wrong path and dropped.",Make autosave request a checkpoint through the same collaboration-aware flush/event dispatcher.,Trigger autosave while a local batch and remote import are in flight.,One canonical command/persistence/sync pipeline is required.,https://github.com/realartists-gitmo/flowstate/blob/0d0ecea88c71f90ddf6cc266da028242c8366646/crates/flowstate/src/workspace/workspace/documents.rs#L1450-L1464,Unchanged,The latest two commits do not modify the code establishing this finding.,9cb8ad8add47db2e3cefd611053a8d99e4ce4048
FS-062,Medium,Confirmed-static,Close / save,crates/flowstate/src/workspace/workspace/documents.rs,1604-1670,Save-on-close does not explicitly forward checkpoint events before session shutdown.,The file may save locally while peers never receive final revision/edit metadata.,Await common runtime event dispatch and network enqueue before closing the session.,Close a dirty collaborative document and inspect peer/frontier state.,Save and sync are expressions of the same canonical history.,https://github.com/realartists-gitmo/flowstate/blob/0d0ecea88c71f90ddf6cc266da028242c8366646/crates/flowstate/src/workspace/workspace/documents.rs#L1604-L1670,Unchanged,The latest two commits do not modify the code establishing this finding.,9cb8ad8add47db2e3cefd611053a8d99e4ce4048
FS-063,Medium,Confirmed-static,Editor / export lifecycle,crates/gpui-flowtext/src/rich_text/editor/send_export.rs,31-148,Successful save/export replaces the entire editor projection.,This can reset transient local UI state and force unnecessary full layout work even when the projection is only an acknowledged echo.,Acknowledge the frontier and apply only corrective diffs; reserve full replacement for actual divergence.,Export a large document while editing and inspect selection/collapse/layout state.,"Full rebuild is exceptional, not the ordinary path.",https://github.com/realartists-gitmo/flowstate/blob/0d0ecea88c71f90ddf6cc266da028242c8366646/crates/gpui-flowtext/src/rich_text/editor/send_export.rs#L31-L148,Unchanged,The latest two commits do not modify the code establishing this finding.,9cb8ad8add47db2e3cefd611053a8d99e4ce4048
