ID,Severity,Status,Area,File,Lines,Finding,Impact,Fix direction,Verification,Architecture relation,Permalink,Latest review status,Latest review note,Reviewed head
FS-001,Blocker,Confirmed-static,Projection / inline objects,crates/flowstate-document/src/loro_projection.rs,180-268,Object placeholders are always projected as standalone blocks.,Text before and after U+FFFC is split into separate paragraph blocks. Inline equations/images cannot retain inline placement even though the schema supports inline display.,"Represent inline objects inside paragraph projection spans, or explicitly remove inline-object support from the schema and UI. Do not force every placeholder through InputBlock.","Create `A[inline equation]B`, reopen, export, and concurrently edit around both sides.",Conflicts with the plan's requirement that inline and block equations use the same placeholder and are rendered according to metadata.,https://github.com/realartists-gitmo/flowstate/blob/0d0ecea88c71f90ddf6cc266da028242c8366646/crates/flowstate-document/src/loro_projection.rs#L180-L268,Unchanged,The latest two commits do not modify the code establishing this finding.,9cb8ad8add47db2e3cefd611053a8d99e4ce4048
FS-002,High,Confirmed-static,Projection / corruption,crates/flowstate-document/src/loro_projection.rs,234-257,A placeholder with no resolvable block record silently disappears.,"Canonical text can contain a structural anchor that is invisible in the editor, search, and export. A later edit may unknowingly delete or relocate it.",Project an explicit corrupt/missing-object block and schedule a Loro repair; never silently drop the anchor.,"Delete a block-map entry while leaving U+FFFC, then reopen.",The plan requires malformed state to be repaired before further sharing.,https://github.com/realartists-gitmo/flowstate/blob/0d0ecea88c71f90ddf6cc266da028242c8366646/crates/flowstate-document/src/loro_projection.rs#L234-L257,Unchanged,The latest two commits do not modify the code establishing this finding.,9cb8ad8add47db2e3cefd611053a8d99e4ce4048
FS-003,High,Confirmed-static,Projection / corruption,crates/flowstate-document/src/loro_projection.rs,271-294,Malformed or unresolved object anchors are silently skipped.,"Blocks with missing cursor bytes, undecodable cursors, or failed resolution become unreachable without a visible error.","Return structured projection diagnostics, render a recovery placeholder, and schedule canonical repair/quarantine.",Corrupt each anchor field independently and reopen.,Violates deterministic rendering from canonical state and repair expectations.,https://github.com/realartists-gitmo/flowstate/blob/0d0ecea88c71f90ddf6cc266da028242c8366646/crates/flowstate-document/src/loro_projection.rs#L271-L294,Unchanged,The latest two commits do not modify the code establishing this finding.,9cb8ad8add47db2e3cefd611053a8d99e4ce4048
FS-004,High,Confirmed-static,Projection / collisions,crates/flowstate-document/src/loro_projection.rs,271-294,Multiple object blocks at the same resolved cursor overwrite each other in a BTreeMap.,"Only the last block survives projection, causing invisible durable content.","Store a vector per position and define deterministic tie ordering, preferably by CRDT anchor ordering plus durable block ID.",Insert two concurrent objects at one cursor from separate replicas.,Object ordering must be canonical and deterministic.,https://github.com/realartists-gitmo/flowstate/blob/0d0ecea88c71f90ddf6cc266da028242c8366646/crates/flowstate-document/src/loro_projection.rs#L271-L294,Unchanged,The latest two commits do not modify the code establishing this finding.,9cb8ad8add47db2e3cefd611053a8d99e4ce4048
FS-005,High,Confirmed-static,Projection / identity,crates/flowstate-document/src/loro_projection.rs,554-573,Projection fabricates paragraph and block IDs from the current block index when metadata is missing.,"The fallback IDs shift when structure changes and can be used by later commands, causing commands to target the wrong paragraph/block.",Treat missing durable identity as malformed canonical state. Schedule a Loro repair that creates durable IDs before accepting commands.,"Remove paragraph metadata, reopen, insert an object before it, and compare IDs.",All durable IDs must be stored in Loro; projection-generated IDs must not become canonical.,https://github.com/realartists-gitmo/flowstate/blob/0d0ecea88c71f90ddf6cc266da028242c8366646/crates/flowstate-document/src/loro_projection.rs#L554-L573,Unchanged,The latest two commits do not modify the code establishing this finding.,9cb8ad8add47db2e3cefd611053a8d99e4ce4048
FS-006,Medium,Confirmed-static,Projection / assets,crates/flowstate-document/src/loro_projection.rs,306-319,Invalid image asset IDs are coerced to AssetId(0).,"Different malformed references alias the same synthetic ID, hiding corruption and potentially displaying the wrong bytes.",Reject malformed IDs or project an explicit invalid-asset placeholder carrying the raw value.,Set `asset_id` to non-numeric text and reopen.,Asset identity must be canonical and integrity-safe.,https://github.com/realartists-gitmo/flowstate/blob/0d0ecea88c71f90ddf6cc266da028242c8366646/crates/flowstate-document/src/loro_projection.rs#L306-L319,Unchanged,The latest two commits do not modify the code establishing this finding.,9cb8ad8add47db2e3cefd611053a8d99e4ce4048
FS-007,High,Confirmed-static,Projection / captions,crates/flowstate-document/src/loro_projection.rs,477-492,Only the first image-caption paragraph is projected.,Additional caption paragraphs remain in Loro but are invisible and can be lost when the caption is edited through the one-paragraph UI model.,"Change the image projection type to hold a paragraph flow, not one InputParagraph.","Create a two-paragraph caption, reopen, edit, and compare Loro flow.",Caption is an independent paragraph-bearing text flow.,https://github.com/realartists-gitmo/flowstate/blob/0d0ecea88c71f90ddf6cc266da028242c8366646/crates/flowstate-document/src/loro_projection.rs#L477-L492,Unchanged,The latest two commits do not modify the code establishing this finding.,9cb8ad8add47db2e3cefd611053a8d99e4ce4048
FS-008,Medium,Confirmed-static,Projection / plain flows,crates/flowstate-document/src/loro_projection.rs,477-484,"`trim_start_matches('\n')` removes all leading newlines, not only the sentinel.","Legitimate leading blank lines in equation, alt-text, header, footer, or other flows are collapsed.",Remove exactly one sentinel code point when the flow kind requires it.,Create a flow with sentinel plus two leading blank lines and round-trip it.,Projection must deterministically preserve canonical flow contents.,https://github.com/realartists-gitmo/flowstate/blob/0d0ecea88c71f90ddf6cc266da028242c8366646/crates/flowstate-document/src/loro_projection.rs#L477-L484,Unchanged,The latest two commits do not modify the code establishing this finding.,9cb8ad8add47db2e3cefd611053a8d99e4ce4048
FS-009,High,Confirmed-static,Projection / tables,crates/flowstate-document/src/loro_projection.rs,398-426,Images and equations inside table-cell flows are discarded.,"Canonical nested objects can exist but vanish from the table projection, search/export view, and editor.",Extend TableCellBlock to represent all supported object kinds or prevent their insertion canonically with explicit validation.,"Insert an image and equation into a cell flow, reopen, and export.",Cell flows are continuous flows and the object-placeholder strategy applies to supporting flows.,https://github.com/realartists-gitmo/flowstate/blob/0d0ecea88c71f90ddf6cc266da028242c8366646/crates/flowstate-document/src/loro_projection.rs#L398-L426,Unchanged,The latest two commits do not modify the code establishing this finding.,9cb8ad8add47db2e3cefd611053a8d99e4ce4048
FS-010,High,Likely,Projection / tables,crates/flowstate-document/src/loro_projection.rs,340-395,Ragged or overlapping table topology is accepted without a normalization/repair phase.,"Concurrent row/column/cell edits can produce missing cells, duplicate coordinates, invalid spans, or partial rows that render inconsistently.",Add a deterministic table-grid validator and canonical repair transaction; project explicit conflict placeholders until repaired.,"Fuzz concurrent row/column insertion, deletion, span edits, and cell removal.","Tables must remain structured, deterministic CRDT objects.",https://github.com/realartists-gitmo/flowstate/blob/0d0ecea88c71f90ddf6cc266da028242c8366646/crates/flowstate-document/src/loro_projection.rs#L340-L395,Unchanged,The latest two commits do not modify the code establishing this finding.,9cb8ad8add47db2e3cefd611053a8d99e4ce4048
FS-011,Medium,Lead,Projection / sections,crates/flowstate-document/src/loro_projection.rs,130-177,Sections whose start paragraph cannot be resolved are sorted to the end instead of repaired or rejected.,Dangling section metadata can appear attached to unrelated content.,Validate all paragraph references and surface/schedule repair for dangling section anchors.,Delete a section's referenced paragraph concurrently and reopen.,Section boundaries must be CRDT-stable positions.,https://github.com/realartists-gitmo/flowstate/blob/0d0ecea88c71f90ddf6cc266da028242c8366646/crates/flowstate-document/src/loro_projection.rs#L130-L177,Unchanged,The latest two commits do not modify the code establishing this finding.,9cb8ad8add47db2e3cefd611053a8d99e4ce4048
FS-012,High,Confirmed-static,Editor / sections,crates/gpui-flowtext/src/rich_text/editor/lifecycle.rs,19-23,Editor construction immediately rebuilds sections from heading styles.,Canonical Loro page sections loaded by the projector can be overwritten by a derived outline before first render.,Separate page sections from heading outline. Never call `rebuild_document_sections` over canonical projected sections.,Open a document with a non-heading section boundary and inspect the editor projection.,Page sections and heading outline are distinct concepts in the architecture.,https://github.com/realartists-gitmo/flowstate/blob/0d0ecea88c71f90ddf6cc266da028242c8366646/crates/gpui-flowtext/src/rich_text/editor/lifecycle.rs#L19-L23,Unchanged,The latest two commits do not modify the code establishing this finding.,9cb8ad8add47db2e3cefd611053a8d99e4ce4048
FS-013,High,Confirmed-static,Editor / projection patches,crates/gpui-flowtext/src/rich_text/editor/projection_apply.rs,92-145,Every structural projection patch rebuilds the document from blocks.,The rebuild discards section/page metadata and resets unrelated projection state and caches.,"Apply structural patches to a frontier-scoped projection structure that preserves sections, IDs, assets, and page metadata; use full canonical reproject only as fallback.",Apply a remote object insertion to a document with section page settings.,Projection caches are derived but must faithfully represent the same canonical frontier.,https://github.com/realartists-gitmo/flowstate/blob/0d0ecea88c71f90ddf6cc266da028242c8366646/crates/gpui-flowtext/src/rich_text/editor/projection_apply.rs#L92-L145,Unchanged,The latest two commits do not modify the code establishing this finding.,9cb8ad8add47db2e3cefd611053a8d99e4ce4048
FS-014,High,Confirmed-static,Schema integration / sections,crates/flowstate-document/src/loro_schema.rs,43-220,Section page attributes are defined canonically but are not consistently preserved through editor mutation and export.,The data exists in Loro yet becomes functionally dead or is lost in projection rebuilds.,"Add end-to-end projection, editor, DOCX, PDF, and package round-trip coverage for every section field.","Round-trip non-default page size, margins, columns, orientation, numbering, header, and footer.",The plan requires sections and page structure to operate from Loro state.,https://github.com/realartists-gitmo/flowstate/blob/0d0ecea88c71f90ddf6cc266da028242c8366646/crates/flowstate-document/src/loro_schema.rs#L43-L220,Unchanged,The latest two commits do not modify the code establishing this finding.,9cb8ad8add47db2e3cefd611053a8d99e4ce4048
FS-015,Medium,Confirmed-static,Schema / sections,crates/flowstate-document/src/loro_schema.rs,451-482,Clearing a header or footer does not remove the old flow-ID attribute.,Setting `None` leaves stale canonical references active.,Delete the map key when the new optional value is None; decide retention policy for unreachable flows separately.,"Set header/footer, clear them, and read attributes back.",Canonical metadata must reflect current state exactly.,https://github.com/realartists-gitmo/flowstate/blob/0d0ecea88c71f90ddf6cc266da028242c8366646/crates/flowstate-document/src/loro_schema.rs#L451-L482,Unchanged,The latest two commits do not modify the code establishing this finding.,9cb8ad8add47db2e3cefd611053a8d99e4ce4048
FS-016,Medium,Confirmed-static,Schema / validation,crates/flowstate-document/src/loro_schema.rs,463-510,Section numeric attributes are not range-validated.,"Negative/zero dimensions, margins, columns, and numbering starts can enter canonical state and break render/export.",Validate and normalize at the semantic command boundary; retain raw malformed values only for diagnostics.,Inject negative and extreme values through Loro import.,Runtime owns schema validation.,https://github.com/realartists-gitmo/flowstate/blob/0d0ecea88c71f90ddf6cc266da028242c8366646/crates/flowstate-document/src/loro_schema.rs#L463-L510,Unchanged,The latest two commits do not modify the code establishing this finding.,9cb8ad8add47db2e3cefd611053a8d99e4ce4048
FS-017,High,Confirmed-static,Projection / paragraph-object semantics,crates/flowstate-collab/src/crdt_runtime/projection_patch.rs,210-247,Incremental paragraph projection ignores object placeholders while full projection splits around them.,Full rebuild and incremental update can produce different paragraph indexes and text around the same canonical frontier.,"Use one shared flow parser for full and incremental projection, including inline/object spans.",Edit text adjacent to an object and compare incremental result with a forced full rebuild.,Deterministic rendering from canonical state requires equivalent projection paths.,https://github.com/realartists-gitmo/flowstate/blob/0d0ecea88c71f90ddf6cc266da028242c8366646/crates/flowstate-collab/src/crdt_runtime/projection_patch.rs#L210-L247,Unchanged,The latest two commits do not modify the code establishing this finding.,9cb8ad8add47db2e3cefd611053a8d99e4ce4048
FS-018,Medium,Lead,Projection / object ordering,crates/flowstate-document/src/loro_projection.rs,31-45,`object_input_blocks_from_loro` sorts objects by BlockId rather than body anchor.,"Any caller treating this as document order receives registry order, not canonical flow order.",Rename it to registry-order explicitly or return objects in body-anchor order with reachability filtering.,Trace all call sites and compare order with a document containing moved objects.,Body flow is canonical for body-object ordering.,https://github.com/realartists-gitmo/flowstate/blob/0d0ecea88c71f90ddf6cc266da028242c8366646/crates/flowstate-document/src/loro_projection.rs#L31-L45,Unchanged,The latest two commits do not modify the code establishing this finding.,9cb8ad8add47db2e3cefd611053a8d99e4ce4048
FS-019,Medium,Confirmed-static,Diagnostics,crates/flowstate-collab/src/self_check.rs,10-35,"Projection drift hash ignores sections, IDs, frontier, assets, and page metadata.",The self-check can report equality while meaningful projected state differs.,"Hash all user-visible and command-targeting projection fields, or use a canonical serialized diagnostic projection.",Modify only section/page/ID/asset state and compare hashes.,Projection integrity checks should cover all derived state.,https://github.com/realartists-gitmo/flowstate/blob/0d0ecea88c71f90ddf6cc266da028242c8366646/crates/flowstate-collab/src/self_check.rs#L10-L35,Unchanged,The latest two commits do not modify the code establishing this finding.,9cb8ad8add47db2e3cefd611053a8d99e4ce4048
FS-020,Low,Confirmed-static,Diagnostics / performance,crates/flowstate-collab/src/self_check.rs,28-31,Object drift hashing formats entire blocks with Debug.,Large tables and nested structures cause avoidable allocation and unstable diagnostic hashing.,Implement explicit stable hashing for each block type.,Benchmark hash on large nested tables.,Observability should not create large hidden work.,https://github.com/realartists-gitmo/flowstate/blob/0d0ecea88c71f90ddf6cc266da028242c8366646/crates/flowstate-collab/src/self_check.rs#L28-L31,Unchanged,The latest two commits do not modify the code establishing this finding.,9cb8ad8add47db2e3cefd611053a8d99e4ce4048
FS-021,Blocker,Confirmed-static,CRDT runtime / transactions,crates/flowstate-collab/src/crdt_runtime.rs,942-989,A semantic command batch is committed command-by-command and can fail halfway.,"Earlier commands are already canonical, persisted, and emitted before a later command returns an error. The caller sees failure, undo grouping may be missing, and peers can observe intermediate state.","Pre-resolve and validate the entire batch against one frontier, then apply it in one Loro transaction/change and one UndoManager group. Roll back or fork a staged doc on failure.","Submit a valid insert followed by an invalid style/ID command and inspect Loro, package, UI, and outbound updates.",The plan requires grouped semantic commands to become grouped Loro changes.,https://github.com/realartists-gitmo/flowstate/blob/0d0ecea88c71f90ddf6cc266da028242c8366646/crates/flowstate-collab/src/crdt_runtime.rs#L942-L989,Unchanged,The latest two commits do not modify the code establishing this finding.,9cb8ad8add47db2e3cefd611053a8d99e4ce4048
FS-022,High,Confirmed-static,Editor command generation,crates/gpui-flowtext/src/rich_text/editor/edit_pipeline.rs,193-276,Normal edits routinely generate multi-command batches.,"The partial-commit defect is reachable through ordinary replacements, formatting, and paste rather than only malformed API calls.",Fix runtime atomicity; do not rely on command producers to emit one command.,"Exercise replace-selection, paste, and style changes with an injected failure after the first command.",Semantic undo units must be atomic.,https://github.com/realartists-gitmo/flowstate/blob/0d0ecea88c71f90ddf6cc266da028242c8366646/crates/gpui-flowtext/src/rich_text/editor/edit_pipeline.rs#L193-L276,Unchanged,The latest two commits do not modify the code establishing this finding.,9cb8ad8add47db2e3cefd611053a8d99e4ce4048
FS-023,High,Confirmed-static,Workspace / command queues,crates/flowstate/src/workspace/workspace/documents.rs,1726-1753,Queued edit batches are flattened across frontiers with only a debug assertion.,Release builds can combine commands constructed from different projections into one request.,Reject mixed-frontier queues in all builds and rebase each queued command through canonical cursors or resnapshot before submitting.,Queue a second edit after a remote update before the first local flush completes.,Projection coordinates are valid only at their originating frontier.,https://github.com/realartists-gitmo/flowstate/blob/0d0ecea88c71f90ddf6cc266da028242c8366646/crates/flowstate/src/workspace/workspace/documents.rs#L1726-L1753,Unchanged,The latest two commits do not modify the code establishing this finding.,9cb8ad8add47db2e3cefd611053a8d99e4ce4048
FS-024,High,Likely,CRDT actor / coalescing,crates/flowstate-collab/src/crdt_runtime_actor.rs,360-470,Actor coalescing can merge distinct submitters that happen to share a frontier.,"Only one response/event stream may represent multiple requests, and coordinate dependencies between requests are not explicit.",Attach monotonically increasing edit-request IDs; preserve one response per request or prove a single serialized producer invariant.,Concurrent-submit two batches from save/export and live flush.,"One runtime owner is correct, but request semantics must remain explicit.",https://github.com/realartists-gitmo/flowstate/blob/0d0ecea88c71f90ddf6cc266da028242c8366646/crates/flowstate-collab/src/crdt_runtime_actor.rs#L360-L470,Unchanged,The latest two commits do not modify the code establishing this finding.,9cb8ad8add47db2e3cefd611053a8d99e4ce4048
FS-025,Critical,Confirmed-static,CRDT runtime / authorship,crates/flowstate-collab/src/crdt_runtime.rs,639-649,`set_author_identity` commits canonical Loro state without persistence or LocalUpdate emission.,"The frontier advances outside the package update chain and outside collaboration. Later edits may be stale, and durable user/replica metadata can disappear after reopen.","Route identity changes through the same local-change pipeline as document mutations: capture from frontier/VV, append update, emit LocalUpdate, refresh projection if needed.","Join a session, set identity, close before editing, reopen, and inspect users/replicas.",All canonical Loro changes must be persisted and synchronized.,https://github.com/realartists-gitmo/flowstate/blob/0d0ecea88c71f90ddf6cc266da028242c8366646/crates/flowstate-collab/src/crdt_runtime.rs#L639-L649,Unchanged,The latest two commits do not modify the code establishing this finding.,9cb8ad8add47db2e3cefd611053a8d99e4ce4048
FS-026,High,Confirmed-static,Collaboration startup,crates/flowstate/src/collab/session.rs,650-705,Author registration is launched separately from the first editor flush.,A first edit can race the metadata commit and be rejected as stale or be acknowledged against an unexpected frontier.,Complete runtime initialization and identity persistence before enabling editor capture.,Join and type immediately under artificial actor delay.,The editor projection frontier must match the live runtime before command construction.,https://github.com/realartists-gitmo/flowstate/blob/0d0ecea88c71f90ddf6cc266da028242c8366646/crates/flowstate/src/collab/session.rs#L650-L705,Unchanged,The latest two commits do not modify the code establishing this finding.,9cb8ad8add47db2e3cefd611053a8d99e4ce4048
FS-027,High,Confirmed-static,CRDT runtime / durability,crates/flowstate-collab/src/crdt_runtime.rs,1556-1578,Persistence occurs after the Loro mutation is committed.,A disk/journal failure leaves canonical in-memory state changed while the method returns an error and may emit no projection/network events.,"Stage the update and package write before acknowledging success, or track an explicit durable-dirty state and still return canonical events so the UI cannot diverge.",Inject append failure after a valid command.,Canonical mutation and durable append need a defined failure contract.,https://github.com/realartists-gitmo/flowstate/blob/0d0ecea88c71f90ddf6cc266da028242c8366646/crates/flowstate-collab/src/crdt_runtime.rs#L1556-L1578,Unchanged,The latest two commits do not modify the code establishing this finding.,9cb8ad8add47db2e3cefd611053a8d99e4ce4048
FS-028,High,Confirmed-static,Package state / durability,crates/flowstate-document/src/package.rs,371-405,`append_update_segment` mutates the in-memory package before validation completes.,A validation error leaves the package object partially advanced.,"Build a cloned/staged package, validate it, then replace `self` only after success.",Inject invalid frontier/checksum state and compare package before/after error.,Crash-safe package coordination must be transactional.,https://github.com/realartists-gitmo/flowstate/blob/0d0ecea88c71f90ddf6cc266da028242c8366646/crates/flowstate-document/src/package.rs#L371-L405,Unchanged,The latest two commits do not modify the code establishing this finding.,9cb8ad8add47db2e3cefd611053a8d99e4ce4048
FS-029,High,Confirmed-static,Package state / assets,crates/flowstate-document/src/package.rs,322-326,`replace_assets_from_document` mutates package assets before all fallible validation work.,An error leaves asset indexes and bytes partially changed in memory.,Stage and validate asset replacement before committing to `self`.,Inject malformed asset metadata or index failure.,Package updates must be all-or-nothing.,https://github.com/realartists-gitmo/flowstate/blob/0d0ecea88c71f90ddf6cc266da028242c8366646/crates/flowstate-document/src/package.rs#L322-L326,Unchanged,The latest two commits do not modify the code establishing this finding.,9cb8ad8add47db2e3cefd611053a8d99e4ce4048
FS-030,High,Confirmed-static,Save / checkpoint,crates/flowstate-collab/src/crdt_runtime.rs,1469-1537,Checkpointing performs many fallible canonical/package mutations without a transaction boundary.,"Failure after revision insertion, cache rebuild, compaction, or path change can leave an internally inconsistent runtime and misleading save status.",Construct a staged checkpoint package and write atomically; only then swap runtime package state and mark saved.,Inject a failure at each step in sequence.,Explicit save is a revision boundary and must be crash-safe.,https://github.com/realartists-gitmo/flowstate/blob/0d0ecea88c71f90ddf6cc266da028242c8366646/crates/flowstate-collab/src/crdt_runtime.rs#L1469-L1537,Unchanged,The latest two commits do not modify the code establishing this finding.,9cb8ad8add47db2e3cefd611053a8d99e4ce4048
FS-031,High,Likely,Journal continuity,crates/flowstate-collab/src/crdt_runtime.rs,1556-1578,A failed append can be followed by a later append from advanced in-memory state.,"The disk journal can receive a segment whose `from_frontier` is not present on disk, creating a replay gap.",Track last durable frontier separately and refuse further appends until the missing segment is durably written or a full atomic snapshot replaces the file.,"Fail one append, allow a later edit to succeed, then reopen from disk.",Update segments must form a complete replay chain.,https://github.com/realartists-gitmo/flowstate/blob/0d0ecea88c71f90ddf6cc266da028242c8366646/crates/flowstate-collab/src/crdt_runtime.rs#L1556-L1578,Unchanged,The latest two commits do not modify the code establishing this finding.,9cb8ad8add47db2e3cefd611053a8d99e4ce4048
